{
  "id": "lighthouse-accessibility",
  "name": "Lighthouse accessibility score",
  "rule": "Lighthouse accessibility score must be 90 or above",
  "measurement": { "type": "lighthouse-metric", "method": "Run Lighthouse, check categories.accessibility.score" },
  "threshold": 0.9,
  "type": "non-functional",
  "tier": "global",
  "domain": null,
  "source": "rouge-seed-v1",
  "version": 1,
  "status": "active",
  "deprecated_reason": null
}
